job_role,skills
Data Scientist,sklearn machine learning pandas numpy
Frontend Developer,html javascript css react
Backend Developer,api development database flask django
Machine Learning Engineer,tensorflow mlops deep learning python
QA Engineer,selenium debugging testing automation test cases
Cybersecurity Analyst,network security vulnerability assessment ethical hacking encryption
AI Engineer,nlp python tensorflow computer vision
Data Scientist,data visualization numpy statistics pandas machine learning sklearn
Blockchain Developer,smart contracts ethereum web3 solidity
Software Engineer,system design c++ data structures algorithms
Machine Learning Engineer,model deployment deep learning mlops pytorch
Data Analyst,data cleaning sql powerbi excel tableau
Data Scientist,statistics machine learning data visualization python pandas numpy
Frontend Developer,html redux responsive design react css javascript
Data Analyst,tableau data cleaning excel powerbi sql
Database Administrator,backup sql recovery performance tuning
QA Engineer,test cases testing selenium debugging automation
QA Engineer,test cases automation testing debugging selenium
AI Engineer,nlp python deep learning tensorflow computer vision
DevOps Engineer,monitoring aws kubernetes ci cd
Cybersecurity Analyst,ethical hacking encryption network security vulnerability assessment
Cloud Engineer,aws security gcp networking cloud architecture azure
Cloud Engineer,azure gcp networking security cloud architecture aws
Data Scientist,python sklearn pandas numpy data visualization statistics machine learning
QA Engineer,selenium automation testing test cases
Backend Developer,python database sql django flask api development
Full Stack Developer,react mongodb javascript html css nodejs
Machine Learning Engineer,mlops python deep learning model deployment pytorch
Data Analyst,sql data cleaning tableau excel powerbi python
Software Engineer,c++ algorithms java data structures system design
Full Stack Developer,javascript html react css
Blockchain Developer,solidity web3 ethereum smart contracts
Database Administrator,performance tuning recovery database management sql backup
Backend Developer,python django api development flask
Software Engineer,algorithms java data structures system design
Cloud Engineer,cloud architecture security networking gcp azure aws
Frontend Developer,javascript html css redux
AI Engineer,tensorflow deep learning computer vision nlp
DevOps Engineer,linux aws docker kubernetes ci cd monitoring
Backend Developer,flask python api development django
Blockchain Developer,solidity web3 smart contracts ethereum
Data Analyst,powerbi data cleaning python tableau excel
Data Analyst,powerbi excel python data cleaning tableau
Full Stack Developer,nodejs css javascript react html mongodb
Machine Learning Engineer,model deployment pytorch mlops python deep learning
Full Stack Developer,mongodb react css javascript html nodejs
Cybersecurity Analyst,ethical hacking network security encryption vulnerability assessment
Database Administrator,backup recovery performance tuning sql database management
Mobile App Developer,ios java swift kotlin android
DevOps Engineer,linux docker monitoring kubernetes
Cybersecurity Analyst,ethical hacking vulnerability assessment encryption network security
DevOps Engineer,ci cd docker monitoring linux aws
QA Engineer,test cases testing debugging selenium automation
Blockchain Developer,web3 smart contracts ethereum solidity
QA Engineer,debugging test cases automation testing selenium
Full Stack Developer,nodejs react html javascript
DevOps Engineer,docker aws ci cd monitoring
Mobile App Developer,android kotlin java swift
Full Stack Developer,html javascript react mongodb
Database Administrator,sql performance tuning backup recovery
Cybersecurity Analyst,encryption ethical hacking vulnerability assessment network security
Cybersecurity Analyst,vulnerability assessment encryption ethical hacking network security
Data Analyst,sql data cleaning tableau excel powerbi
Machine Learning Engineer,python deep learning mlops pytorch model deployment
Cloud Engineer,cloud architecture security networking azure gcp
Frontend Developer,css responsive design react javascript html redux
Database Administrator,recovery sql database management backup
Cybersecurity Analyst,encryption vulnerability assessment ethical hacking network security
QA Engineer,testing debugging test cases automation
QA Engineer,testing test cases selenium debugging automation
Cybersecurity Analyst,ethical hacking vulnerability assessment encryption network security
Data Scientist,statistics sklearn machine learning pandas
Machine Learning Engineer,model deployment deep learning pytorch python tensorflow
Software Engineer,c++ algorithms system design java
Mobile App Developer,android kotlin ios swift
Software Engineer,algorithms data structures c++ java
Frontend Developer,css javascript react redux html responsive design
QA Engineer,testing automation selenium debugging
Database Administrator,recovery backup performance tuning database management sql
QA Engineer,selenium automation test cases testing
DevOps Engineer,kubernetes linux ci cd aws docker monitoring
Full Stack Developer,mongodb react css html
QA Engineer,automation selenium test cases debugging
DevOps Engineer,aws docker linux monitoring kubernetes
